Table 6 30: Costing of the proposed activities for conserving the Forest/water resources,,,,
,Proposed intervention,Unit rate,Extent / Length/ No,Total cost (Rs) 
1,Community awareness session,5000,2,"10,000"
2,Demarcation of the area with the community (Obtain GPS coordinates) ,5000,2,"10,000"
3,Formation of vigilant committees in the peripheral villages (existing CBO can be used for this) ,Lump Sum,2,"10,000"
4,Erect sign boards to show the area is protected as a water source,5000,02× 02,10 000
5,Map the stream flow pathways downstream,Lump Sum,2,"10,000"
6,Purchase of Plants and Planting,Lump Sum,2,"10,000"
,Total,,,"60,000"
